<?xml version="1.0" encoding="utf-8" ?>
<xs:schema version="1.0" xmlns:xs="http://www.w3.org/2001/XMLSchema" elementFormDefault="qualified">
    <xs:element name="breakfast_menu">
        <xs:complexType>
            <xs:sequence>
                <xs:element name="food" maxOccurs="unbounded">
                    <xs:complexType>
                        <xs:sequence>
                            <xs:element name="name" type="xs:string"/>
                            <xs:element name="price">
                                <xs:complexType>
                                    <xs:simpleContent>
                                        <xs:extension base="xs:decimal">
                                            <xs:attribute name="curr" type="xs:string" default="$"/>
                                        </xs:extension>
                                    </xs:simpleContent>
                                </xs:complexType>
                            </xs:element>
                            <xs:element name="description" type="xs:string"/>
                            <xs:element name="calories" type="xs:integer" minOccurs="0"/>
                        </xs:sequence>
                        <xs:attribute name="type">
                            <xs:simpleType>
                                <xs:restriction base="xs:string">
                                    <xs:pattern value="fruits|bread|vegetables|milk"/>
                                </xs:restriction>

                            </xs:simpleType>
                        </xs:attribute>
                    </xs:complexType>
                </xs:element>
            </xs:sequence>
        </xs:complexType>
    </xs:element>
</xs:schema>