<?xml version="1.0" encoding="UTF-8"?>

<breakfast_menu xmlns:xsi='http://www.w3.org/2001/XMLSchema-instance'
                xsi:noNamespaceSchemaLocation='breakfastMenuXMLDocument.xsd'>
    <food type="bread"> <!-- atrybut musi wystąpić, tylko fruits|bread|milk|vegetables -->
        <name>Belgian Waffles</name> <!-- musi wystąpić -->
        <price curr="EUR">5.95</price> <!-- musi wystąpić -->
        <description> <!-- musi wystąpić min 20 znaków, max 100 znaków-->
            Two of our famous Belgian Waffles with plenty of real maple syrup
        </description>
        <calories>650</calories> <!-- brak wartości ujemnych -->
    </food>
    <food type="bread">
        <name>Strawberry Belgian Waffles</name>
        <price>7.95</price>
        <description>
            Light Belgian waffles covered with strawberries and whipped cream
        </description>
        <calories>900</calories>
    </food>
    <food type="fruits">
        <name>Strawberries</name>
        <price>4.95</price>
        <description>
            Fresh tasty strawberries
        </description>
        <calories>90</calories>
    </food>
</breakfast_menu>
